{
  "schema_version": "1.1",
  "kit": {
    "name": "NGM SElect",
    "display_name": "AmpFlSTR NGM SElect PCR Amplification Kit",
    "manufacturer": "Applied Biosystems / Life Technologies",
    "definition_version": "1.0.0",
    "aliases": [
      "AmpFlSTR NGM SElect",
      "AmpFℓSTR NGM SElect",
      "NGM SElect PCR Amplification Kit"
    ],
    "channels": [
      {
        "code": "FAM",
        "label": "6-FAM",
        "color_name": "blue",
        "svg_color": "#0067C5",
        "order": 0,
        "aliases": [
          "6-FAM",
          "FAM",
          "Blue",
          "B"
        ]
      },
      {
        "code": "VIC",
        "label": "VIC",
        "color_name": "green",
        "svg_color": "#008B45",
        "order": 1,
        "aliases": [
          "VIC",
          "Green",
          "G"
        ]
      },
      {
        "code": "NED",
        "label": "NED",
        "color_name": "yellow",
        "svg_color": "#D8A500",
        "order": 2,
        "aliases": [
          "NED",
          "Yellow",
          "Black",
          "Y"
        ]
      },
      {
        "code": "PET",
        "label": "PET",
        "color_name": "red",
        "svg_color": "#C62828",
        "order": 3,
        "aliases": [
          "PET",
          "Red",
          "R"
        ]
      }
    ],
    "kit_type": "autosomal",
    "export_compatibility": "genemapper",
    "notes": [],
    "linkage_groups": {}
  },
  "coordinate_model": {
    "model_version": "0.11-ngm-select-1",
    "coordinate_kind": "range_centered_nominal",
    "exact_bin_centres": false
  },
  "sources": [
    {
      "title": "AmpFlSTR NGM SElect PCR Amplification Kit User Guide, PN 4458841",
      "use": "marker set, channel layout, allelic ladder and nominal panel organization"
    },
    {
      "title": "Thermo Fisher NGM SElect product information",
      "use": "confirmation that NGM SElect adds SE33 in the PET red channel to the NGM marker set"
    }
  ],
  "markers": [
    {
      "name": "D10S1248",
      "aliases": [],
      "dye": "FAM",
      "order_in_dye": 0,
      "ladder_alleles": [
        "8",
        "9",
        "10",
        "11",
        "12",
        "13",
        "14",
        "15",
        "16",
        "17",
        "18"
      ],
      "coordinate": {
        "range_min_bp": 72.0,
        "range_max_bp": 127.0,
        "placement_method": "range_centered_repeat",
        "source_note": "Manufacturer NGM_panel_v2 minimum/maximum panel range; coordinates are nominal display positions, not measured sample sizes or asserted exact bin centres.",
        "repeat_length_bp": 4
      },
      "marker_type": "str",
      "copy_group": null,
      "linkage_group": null,
      "is_control": false
    },
    {
      "name": "vWA",
      "aliases": [],
      "dye": "FAM",
      "order_in_dye": 1,
      "ladder_alleles": [
        "11",
        "12",
        "13",
        "14",
        "15",
        "16",
        "17",
        "18",
        "19",
        "20",
        "21",
        "22",
        "23",
        "24"
      ],
      "coordinate": {
        "range_min_bp": 149.0,
        "range_max_bp": 214.3,
        "placement_method": "range_centered_repeat",
        "source_note": "Manufacturer NGM_panel_v2 minimum/maximum panel range; coordinates are nominal display positions, not measured sample sizes or asserted exact bin centres.",
        "repeat_length_bp": 4
      },
      "marker_type": "str",
      "copy_group": null,
      "linkage_group": null,
      "is_control": false
    },
    {
      "name": "D16S539",
      "aliases": [],
      "dye": "FAM",
      "order_in_dye": 2,
      "ladder_alleles": [
        "5",
        "8",
        "9",
        "10",
        "11",
        "12",
        "13",
        "14",
        "15"
      ],
      "coordinate": {
        "range_min_bp": 223.6,
        "range_max_bp": 277.6,
        "placement_method": "range_centered_repeat",
        "source_note": "Manufacturer NGM_panel_v2 minimum/maximum panel range; coordinates are nominal display positions, not measured sample sizes or asserted exact bin centres.",
        "repeat_length_bp": 4
      },
      "marker_type": "str",
      "copy_group": null,
      "linkage_group": null,
      "is_control": false
    },
    {
      "name": "D2S1338",
      "aliases": [],
      "dye": "FAM",
      "order_in_dye": 3,
      "ladder_alleles": [
        "15",
        "16",
        "17",
        "18",
        "19",
        "20",
        "21",
        "22",
        "23",
        "24",
        "25",
        "26",
        "27",
        "28"
      ],
      "coordinate": {
        "range_min_bp": 281.6,
        "range_max_bp": 356.0,
        "placement_method": "range_centered_repeat",
        "source_note": "Manufacturer NGM_panel_v2 minimum/maximum panel range; coordinates are nominal display positions, not measured sample sizes or asserted exact bin centres.",
        "repeat_length_bp": 4
      },
      "marker_type": "str",
      "copy_group": null,
      "linkage_group": null,
      "is_control": false
    },
    {
      "name": "Amelogenin",
      "aliases": [
        "AM",
        "AMEL"
      ],
      "dye": "VIC",
      "order_in_dye": 0,
      "ladder_alleles": [
        "X",
        "Y"
      ],
      "coordinate": {
        "range_min_bp": 100.0,
        "range_max_bp": 108.0,
        "placement_method": "explicit",
        "source_note": "Nominal X/Y positions preserve the six-base separation and are centred within the manufacturer NGM_panel_v2 range; they are not measured sample sizes or asserted exact bin centres.",
        "explicit_positions": {
          "X": 101.0,
          "Y": 107.0
        }
      },
      "marker_type": "amelogenin",
      "copy_group": null,
      "linkage_group": null,
      "is_control": false
    },
    {
      "name": "D8S1179",
      "aliases": [],
      "dye": "VIC",
      "order_in_dye": 1,
      "ladder_alleles": [
        "8",
        "9",
        "10",
        "11",
        "12",
        "13",
        "14",
        "15",
        "16",
        "17",
        "18",
        "19"
      ],
      "coordinate": {
        "range_min_bp": 117.9,
        "range_max_bp": 174.9,
        "placement_method": "range_centered_repeat",
        "source_note": "Manufacturer NGM_panel_v2 minimum/maximum panel range; coordinates are nominal display positions, not measured sample sizes or asserted exact bin centres.",
        "repeat_length_bp": 4
      },
      "marker_type": "str",
      "copy_group": null,
      "linkage_group": null,
      "is_control": false
    },
    {
      "name": "D21S11",
      "aliases": [],
      "dye": "VIC",
      "order_in_dye": 2,
      "ladder_alleles": [
        "24",
        "24.2",
        "25",
        "26",
        "27",
        "28",
        "28.2",
        "29",
        "29.2",
        "30",
        "30.2",
        "31",
        "31.2",
        "32",
        "32.2",
        "33",
        "33.2",
        "34",
        "34.2",
        "35",
        "35.2",
        "36",
        "37",
        "38"
      ],
      "coordinate": {
        "range_min_bp": 178.8,
        "range_max_bp": 249.8,
        "placement_method": "range_centered_repeat",
        "source_note": "Manufacturer NGM_panel_v2 minimum/maximum panel range; coordinates are nominal display positions, not measured sample sizes or asserted exact bin centres.",
        "repeat_length_bp": 4
      },
      "marker_type": "str",
      "copy_group": null,
      "linkage_group": null,
      "is_control": false
    },
    {
      "name": "D18S51",
      "aliases": [],
      "dye": "VIC",
      "order_in_dye": 3,
      "ladder_alleles": [
        "7",
        "9",
        "10",
        "10.2",
        "11",
        "12",
        "13",
        "13.2",
        "14",
        "14.2",
        "15",
        "16",
        "17",
        "18",
        "19",
        "20",
        "21",
        "22",
        "23",
        "24",
        "25",
        "26",
        "27"
      ],
      "coordinate": {
        "range_min_bp": 259.5,
        "range_max_bp": 347.5,
        "placement_method": "range_centered_repeat",
        "source_note": "Manufacturer NGM_panel_v2 minimum/maximum panel range; coordinates are nominal display positions, not measured sample sizes or asserted exact bin centres.",
        "repeat_length_bp": 4
      },
      "marker_type": "str",
      "copy_group": null,
      "linkage_group": null,
      "is_control": false
    },
    {
      "name": "D22S1045",
      "aliases": [],
      "dye": "NED",
      "order_in_dye": 0,
      "ladder_alleles": [
        "8",
        "9",
        "10",
        "11",
        "12",
        "13",
        "14",
        "15",
        "16",
        "17",
        "18",
        "19"
      ],
      "coordinate": {
        "range_min_bp": 76.0,
        "range_max_bp": 120.0,
        "placement_method": "range_centered_repeat",
        "source_note": "Manufacturer NGM_panel_v2 minimum/maximum panel range; coordinates are nominal display positions, not measured sample sizes or asserted exact bin centres.",
        "repeat_length_bp": 3
      },
      "marker_type": "str",
      "copy_group": null,
      "linkage_group": null,
      "is_control": false
    },
    {
      "name": "D19S433",
      "aliases": [],
      "dye": "NED",
      "order_in_dye": 1,
      "ladder_alleles": [
        "9",
        "10",
        "11",
        "12",
        "12.2",
        "13",
        "13.2",
        "14",
        "14.2",
        "15",
        "15.2",
        "16",
        "16.2",
        "17",
        "17.2"
      ],
      "coordinate": {
        "range_min_bp": 122.3,
        "range_max_bp": 166.3,
        "placement_method": "range_centered_repeat",
        "source_note": "Manufacturer NGM_panel_v2 minimum/maximum panel range; coordinates are nominal display positions, not measured sample sizes or asserted exact bin centres.",
        "repeat_length_bp": 4
      },
      "marker_type": "str",
      "copy_group": null,